description,average,standard_deviation,individual_results,min,max,type
QUERY QUE RETORNE O CÓDIGO IBGE E ID DA FAMILIA APENAS PARA FAMILIAR COM DATA DE ALTERAÇÃO DO ANO DE 2017 DE FORMA ORDENADA.,77.3224365234375,1.2812852950003089,"[78.030517578125, 79.381103515625, 76.17529296875, 78.110595703125, 76.422607421875, 77.59375, 74.6435546875, 78.592041015625, 77.126220703125, 77.148681640625]",74.6435546875,79.381103515625,ccb
Quantidade de domicilios sem banheiro,47.776953125,5.098736827456439,"[47.544189453125, 45.266845703125, 44.50439453125, 62.530029296875, 48.306396484375, 46.092041015625, 44.517578125, 47.92822265625, 46.39990234375, 44.679931640625]",44.50439453125,62.530029296875,ccb
Quantidade de familias que nao possuem domicilio particular regular,30.3571044921875,0.7271370209835897,"[31.064697265625, 30.104248046875, 31.951171875, 29.7919921875, 30.859375, 29.898681640625, 29.78271484375, 30.562255859375, 30.200439453125, 29.35546875]",29.35546875,31.951171875,ccb
Quais dados do domicílio das famílias que possuem apenas um cômodo?,21.674072265625,0.3902374023075691,"[21.957275390625, 21.5126953125, 21.65576171875, 22.14892578125, 21.795654296875, 21.179443359375, 20.8291015625, 21.678955078125, 22.08056640625, 21.90234375]",20.8291015625,22.14892578125,ccb
FAMILIAs QUE TENHA MAIS DE 2 INTEGRANTES,76.4975341796875,3.064959531897282,"[76.17041015625, 76.62109375, 73.4921875, 79.36376953125, 79.399169921875, 75.5595703125, 74.454345703125, 83.116943359375, 73.594970703125, 73.202880859375]",73.202880859375,83.116943359375,ccb
Quais municipios possuem uma população com número inferior à 1000 pessoas?,0.793310546875,0.509770210800883,"[2.315185546875, 0.74658203125, 0.583251953125, 0.592041015625, 0.578369140625, 0.570068359375, 0.6328125, 0.615966796875, 0.626220703125, 0.672607421875]",0.570068359375,2.315185546875,ccb
Média de Idade das Pessoas nas Famílias da base de dados?,25.29130859375,3.139750746701918,"[24.420166015625, 30.021240234375, 29.5517578125, 28.835205078125, 26.650146484375, 23.375732421875, 21.987548828125, 24.95556640625, 21.1591796875, 21.95654296875]",21.1591796875,30.021240234375,ccb
Qual a Idade média da população entrevistada?,21.88564453125,1.0383550498573255,"[23.788818359375, 21.73291015625, 22.831298828125, 22.154296875, 21.645751953125, 23.18310546875, 20.70361328125, 21.2900390625, 21.044189453125, 20.482421875]",20.482421875,23.788818359375,ccb
Qual a Quantidade média de cômodos dos domicílios?,14.9278564453125,2.473019527729377,"[18.103515625, 19.367431640625, 15.68896484375, 17.5068359375, 12.583984375, 12.5498046875, 12.401123046875, 12.8173828125, 13.469482421875, 14.7900390625]",12.401123046875,19.367431640625,ccb
Qual a média de cômodos por domicilio,12.98857421875,0.44346822738374736,"[12.548828125, 13.037841796875, 14.0673828125, 12.72509765625, 12.62841796875, 12.503173828125, 13.21044921875, 12.86669921875, 13.3173828125, 12.98046875]",12.503173828125,14.0673828125,ccb
Quantidade de pessoas por sexo na base de dados?,1328.5135498046875,71.62361014319607,"[1476.280517578125, 1295.97412109375, 1388.249267578125, 1347.256103515625, 1412.472412109375, 1298.49072265625, 1258.552978515625, 1265.01611328125, 1248.075927734375, 1294.767333984375]",1248.075927734375,1476.280517578125,ccb
Valor total da média familiar e total de pessoas por municipio,62.632470703125,9.309361932187674,"[60.971923828125, 61.8251953125, 87.362548828125, 71.08251953125, 61.865234375, 56.386474609375, 56.896728515625, 56.38623046875, 56.558837890625, 56.989013671875]",56.38623046875,87.362548828125,ccb
Quantidade de pessoas agrupadas por nível de escolaridade,44.45126953125,3.7125941980658244,"[51.833740234375, 44.6416015625, 41.490478515625, 41.6416015625, 41.7529296875, 46.198974609375, 50.709228515625, 41.86083984375, 41.86279296875, 42.5205078125]",41.490478515625,51.833740234375,ccb
Pergunta 5: Quais são os tipos de materiais de piso mais comuns nas famílias?,20.956494140625,2.377366668159466,"[21.579345703125, 27.72314453125, 20.295654296875, 19.508544921875, 19.87939453125, 20.14111328125, 21.59814453125, 19.35888671875, 19.917724609375, 19.56298828125]",19.35888671875,27.72314453125,ccb
Agrupe a quantidade de pessoas pelas diferentes cores de pele.,43.5512939453125,19.06625823368514,"[41.288330078125, 34.42138671875, 33.589599609375, 34.09326171875, 34.820556640625, 100.054931640625, 38.961181640625, 37.860595703125, 42.80078125, 37.622314453125]",33.589599609375,100.054931640625,ccb
Quantos idosos existem em cada família no estado da Bahia?,38.03056640625,1.2338630860589872,"[38.6796875, 40.780517578125, 37.09765625, 36.56591796875, 37.888916015625, 38.700439453125, 38.43408203125, 38.038330078125, 37.984619140625, 36.135498046875]",36.135498046875,40.780517578125,cci
Qtd de pessoas por Município e cor/raça,492.5324462890625,16.308681353652396,"[486.146240234375, 487.08251953125, 482.300048828125, 517.352783203125, 505.572021484375, 474.92041015625, 496.005859375, 502.406005859375, 511.389404296875, 462.149169921875]",462.149169921875,517.352783203125,cci
Qual é a média de pessoas por família em cada município?,49.80439453125,3.674338209808647,"[51.02978515625, 46.309814453125, 57.03125, 46.76708984375, 47.728271484375, 47.259033203125, 49.58984375, 46.321533203125, 50.1396484375, 55.86767578125]",46.309814453125,57.03125,cci
"Quantidade de famílias com casas com menos de 3 cômodos agrupados por estado, regiao e municipio:",381.6423095703125,12.14479764200178,"[377.59716796875, 398.111572265625, 399.23193359375, 364.015380859375, 393.10693359375, 386.689453125, 376.421875, 374.966796875, 382.989501953125, 363.29248046875]",363.29248046875,399.23193359375,cci
"Quantidade de pessoas por idade, sexo e função que recebem remunerção equivalente a salário mínimo ou inferior",213.814453125,8.233308209800484,"[206.928955078125, 214.08984375, 231.63720703125, 205.8134765625, 205.575927734375, 218.898193359375, 218.75146484375, 218.88037109375, 203.57080078125, 213.998291015625]",203.57080078125,231.63720703125,cci
Em que municípios moram as 5 pessoas mais velhas entrevistadas?,188.719921875,7.440437161519094,"[183.82177734375, 194.1201171875, 185.734375, 186.284912109375, 175.999267578125, 189.652587890625, 183.9736328125, 199.126220703125, 186.147216796875, 202.339111328125]",175.999267578125,202.339111328125,cci
"Quantidade de famílias com casas com menos de 3 cômodos agrupados por estado, regiao e municipio:",55.8221435546875,1.43877637940889,"[59.67822265625, 56.337890625, 54.858154296875, 55.06640625, 55.39794921875, 55.25244140625, 54.32373046875, 55.995849609375, 54.871337890625, 56.439453125]",54.32373046875,59.67822265625,cci
Quantas mulheres concluíram o ensino fundamental?,44.0511474609375,2.5540115657970572,"[44.667236328125, 44.553466796875, 42.843994140625, 42.9736328125, 48.43505859375, 40.720458984375, 48.94775390625, 42.503173828125, 42.6064453125, 42.26025390625]",40.720458984375,48.94775390625,cci
"Quantas famílias existem em cada município, agrupadas por água canalizada ?",834.0793212890625,13.353455210347226,"[837.174560546875, 820.982666015625, 826.567626953125, 837.78125, 811.66650390625, 844.322998046875, 844.93603515625, 817.711181640625, 845.1884765625, 854.4619140625]",811.66650390625,854.4619140625,cci
Qual a media de pessoas por familia por municipio?,48.663818359375,6.066183769238683,"[55.213623046875, 52.437255859375, 59.15673828125, 49.123291015625, 43.1875, 46.0908203125, 42.05517578125, 54.84619140625, 42.495849609375, 42.03173828125]",42.03173828125,59.15673828125,cci
Qual o curso mais elevado que as pessoas que não tiveram trabalho remunerado nos últimos 12 meses frequentaram?,144.58154296875,10.705668021717,"[147.2177734375, 146.009521484375, 140.320556640625, 143.320068359375, 169.7978515625, 154.228271484375, 135.229736328125, 128.075439453125, 140.995361328125, 140.620849609375]",128.075439453125,169.7978515625,cci
Quais são os cinco municípios com a maior população e quantas famílias vivem em cada um?,47.274951171875,2.6466363004312483,"[50.3447265625, 49.451416015625, 47.4296875, 47.784912109375, 52.54443359375, 45.1884765625, 44.611572265625, 44.21142578125, 46.408203125, 44.774658203125]",44.21142578125,52.54443359375,cci
Quantas famílias com mais de 3 pessoas têm acesso a água canalizada em seus domicílios?,41.151708984375,3.2903036447891894,"[40.169921875, 38.226806640625, 35.954833984375, 44.3916015625, 42.786376953125, 44.746826171875, 39.08984375, 47.126953125, 39.119384765625, 39.904541015625]",35.954833984375,47.126953125,cci
Quantas pessoas do sexo feminino moram em casas com água canalizada?,86.034521484375,3.419251242022475,"[92.966552734375, 89.7744140625, 82.6279296875, 86.084228515625, 82.631591796875, 83.531494140625, 85.05615234375, 81.869140625, 87.63818359375, 88.16552734375]",81.869140625,92.966552734375,cci
"Qual a quantidade de pessoas do sexo masculino e feminino, respectivamente, em Salvador?",33.191845703125,3.7201296015179977,"[40.24267578125, 32.0048828125, 30.524169921875, 30.384033203125, 31.080810546875, 30.563720703125, 31.078369140625, 34.302734375, 40.389404296875, 31.34765625]",30.384033203125,40.389404296875,cci
